{
  "$schema": "urn:sync-project-facts:schema:project-facts:1.0",
  "schema_version": "1.0",
  "ledger_id": "ledger-08c4b90a30ce3b7d",
  "generated_at": "2026-07-15T18:05:51Z",
  "project": {
    "project_id": "project-08c4b90a30ce3b7d",
    "name": "PV-YOLO 光伏缺陷检测",
    "root": "examples/pv-yolo-project/materials"
  },
  "source_manifest_id": "manifest-7403911737eb4801",
  "evidence_set_id": "evidence-set-b750cc1739803738",
  "materials": [
    {
      "source_path": "论文事实.json",
      "source_type": "json",
      "source_hash": "e5cbee2c1f7811d8fa27593f3dbde43ef98dd81e42a006d8038d14cbc982f8a4",
      "modified_at": "2026-07-15T17:45:35Z",
      "size_bytes": 1173,
      "warnings": []
    },
    {
      "source_path": "项目分工.csv",
      "source_type": "csv",
      "source_hash": "d6cc7e121ae2597a762876eb3823453ae6a70584a747459aecd583686aed1d23",
      "modified_at": "2026-07-15T17:45:41Z",
      "size_bytes": 169,
      "warnings": [
        "Decoded as utf-8-sig."
      ]
    },
    {
      "source_path": "项目汇报.md",
      "source_type": "markdown",
      "source_hash": "70936decc4b125333d0a1eb0a14a56827d1ded70ff4c410b14555d31e6499038",
      "modified_at": "2026-07-15T17:45:38Z",
      "size_bytes": 291,
      "warnings": [
        "Decoded as utf-8-sig."
      ]
    }
  ],
  "facts": [
    {
      "fact_id": "fact-1f09a0560500f244",
      "category": "contribution",
      "key": "personal_contribution",
      "canonical_value": null,
      "value_type": "string",
      "unit": null,
      "scope": {},
      "aliases": [],
      "status": "CONTRADICTED",
      "severity": "Critical",
      "confidence": 0.95,
      "evidence": [
        {
          "evidence_id": "evidence-72574fa248e819d3",
          "source_path": "论文事实.json",
          "source_type": "json",
          "source_hash": "e5cbee2c1f7811d8fa27593f3dbde43ef98dd81e42a006d8038d14cbc982f8a4",
          "locator": "$.facts[3]",
          "excerpt": "{\"category\": \"contribution\", \"evidence_kind\": \"structured_data\", \"key\": \"personal_contribution\", \"ownership_level\": \"partial\", \"source_authority\": \"primary\", \"subtype\": \"OWNERSHIP\", \"value\": \"负责数据整理、标注和部分论文写作\"}",
          "extracted_value": "负责数据整理、标注和部分论文写作",
          "modified_at": "2026-07-15T17:45:35Z",
          "evidence_kind": "structured_data"
        },
        {
          "evidence_id": "evidence-c07622c0d9edaeab",
          "source_path": "项目汇报.md",
          "source_type": "markdown",
          "source_hash": "70936decc4b125333d0a1eb0a14a56827d1ded70ff4c410b14555d31e6499038",
          "locator": "line 11",
          "excerpt": "个人工作:独立设计并训练全部模型。",
          "extracted_value": "个人工作:独立设计并训练全部模型。",
          "modified_at": "2026-07-15T17:45:38Z",
          "evidence_kind": "contribution_statement"
        },
        {
          "evidence_id": "evidence-cf94c54ca4297cd1",
          "source_path": "项目分工.csv",
          "source_type": "csv",
          "source_hash": "d6cc7e121ae2597a762876eb3823453ae6a70584a747459aecd583686aed1d23",
          "locator": "row 2, column \"贡献说明\"",
          "excerpt": "贡献说明 = 负责数据整理、标注和部分写作",
          "extracted_value": "负责数据整理、标注和部分写作",
          "modified_at": "2026-07-15T17:45:41Z",
          "evidence_kind": "contribution_statement"
        }
      ],
      "variants": [
        {
          "variant_id": "variant-776e86f38f235901",
          "value": "个人工作:独立设计并训练全部模型。",
          "normalized_value": "个人工作:独立设计并训练全部模型。",
          "value_type": "string",
          "unit": null,
          "scope": {},
          "lifecycle": "unspecified",
          "source_authority": "summary",
          "evidence_ids": [
            "evidence-c07622c0d9edaeab"
          ]
        },
        {
          "variant_id": "variant-9a56f8569352a6cf",
          "value": "负责数据整理、标注和部分论文写作",
          "normalized_value": "负责数据整理、标注和部分论文写作",
          "value_type": "string",
          "unit": null,
          "scope": {},
          "lifecycle": "unspecified",
          "source_authority": "primary",
          "evidence_ids": [
            "evidence-72574fa248e819d3"
          ]
        },
        {
          "variant_id": "variant-b207db3e62d807b9",
          "value": "负责数据整理、标注和部分写作",
          "normalized_value": "负责数据整理、标注和部分写作",
          "value_type": "string",
          "unit": null,
          "scope": {},
          "lifecycle": "unspecified",
          "source_authority": "summary",
          "evidence_ids": [
            "evidence-cf94c54ca4297cd1"
          ]
        }
      ],
      "decision": {
        "state": "pending",
        "human_confirmed": false,
        "selected_variant_id": null,
        "decided_by": null,
        "decided_at": null,
        "rationale": null,
        "history": []
      },
      "notes": [
        "Ownership cannot be inferred from file authorship, code authorship, or stronger wording."
      ],
      "subtype": "OWNERSHIP",
      "repair": "Stop using the broader ownership claim; obtain an explicit team/user confirmation before synchronizing contribution wording."
    },
    {
      "fact_id": "fact-b85157af088c39e3",
      "category": "deployment",
      "key": "deployment_readiness",
      "canonical_value": null,
      "value_type": "boolean",
      "unit": null,
      "scope": {},
      "aliases": [],
      "status": "UNSUPPORTED",
      "severity": "High",
      "confidence": 0.7,
      "evidence": [
        {
          "evidence_id": "evidence-bccf37ee56b1941f",
          "source_path": "项目汇报.md",
          "source_type": "markdown",
          "source_hash": "70936decc4b125333d0a1eb0a14a56827d1ded70ff4c410b14555d31e6499038",
          "locator": "line 9",
          "excerpt": "性能提升 12%,已达到部署要求。",
          "extracted_value": true,
          "modified_at": "2026-07-15T17:45:38Z",
          "evidence_kind": "claim"
        }
      ],
      "variants": [
        {
          "variant_id": "variant-30f8c1badd8947d8",
          "value": true,
          "normalized_value": "true",
          "value_type": "boolean",
          "unit": null,
          "scope": {},
          "lifecycle": "unspecified",
          "source_authority": "claim",
          "evidence_ids": [
            "evidence-bccf37ee56b1941f"
          ]
        }
      ],
      "decision": {
        "state": "pending",
        "human_confirmed": false,
        "selected_variant_id": null,
        "decided_by": null,
        "decided_at": null,
        "rationale": null,
        "history": []
      },
      "notes": [
        "Only claim-level evidence was found for a fact that requires traceable support."
      ],
      "subtype": null,
      "repair": "Remove or qualify the claim until a result table, log, calculation, configuration, or explicit record is linked."
    },
    {
      "fact_id": "fact-ae85323996370485",
      "category": "metric",
      "key": "map_0_5",
      "canonical_value": null,
      "value_type": "percentage",
      "unit": "%",
      "scope": {
        "dataset": "PV-Synth",
        "modality": "RGB",
        "model_version": "v2.0",
        "metric_definition": "map@0.5",
        "iou_threshold": "0.5"
      },
      "aliases": [],
      "status": "CONTRADICTED",
      "severity": "High",
      "confidence": 0.95,
      "evidence": [
        {
          "evidence_id": "evidence-4bf122ba902a8712",
          "source_path": "项目汇报.md",
          "source_type": "markdown",
          "source_hash": "70936decc4b125333d0a1eb0a14a56827d1ded70ff4c410b14555d31e6499038",
          "locator": "line 7",
          "excerpt": "数据集: PV-Synth;模态: RGB;模型版本: v2.0;IoU 阈值: 0.5;mAP@0.5 = 94.2%",
          "extracted_value": 94.2,
          "modified_at": "2026-07-15T17:45:38Z",
          "evidence_kind": "narrative"
        },
        {
          "evidence_id": "evidence-91f7039eb59aba39",
          "source_path": "论文事实.json",
          "source_type": "json",
          "source_hash": "e5cbee2c1f7811d8fa27593f3dbde43ef98dd81e42a006d8038d14cbc982f8a4",
          "locator": "$.facts[2]",
          "excerpt": "{\"category\": \"metric\", \"evidence_kind\": \"result_table\", \"key\": \"map_0_5\", \"scope\": {\"dataset\": \"PV-Synth\", \"iou_threshold\": \"0.5\", \"metric_definition\": \"mAP@0.5\", \"modality\": \"RGB\", \"model_version\": \"v2.0\"}, \"source_authority\": \"formal\", \"unit\": \"%\", \"value\": 93.7, \"value_type\": \"percentage\"}",
          "extracted_value": 93.7,
          "modified_at": "2026-07-15T17:45:35Z",
          "evidence_kind": "result_table"
        }
      ],
      "variants": [
        {
          "variant_id": "variant-26e87847c38c1ce5",
          "value": 93.7,
          "normalized_value": "0.937",
          "value_type": "percentage",
          "unit": "%",
          "scope": {
            "dataset": "PV-Synth",
            "modality": "RGB",
            "metric_definition": "map@0.5",
            "iou_threshold": "0.5",
            "model_version": "v2.0"
          },
          "lifecycle": "unspecified",
          "source_authority": "formal",
          "evidence_ids": [
            "evidence-91f7039eb59aba39"
          ]
        },
        {
          "variant_id": "variant-c38ea4629a1f013b",
          "value": 94.2,
          "normalized_value": "0.942",
          "value_type": "percentage",
          "unit": "%",
          "scope": {
            "modality": "RGB",
            "dataset": "PV-Synth",
            "model_version": "v2.0",
            "iou_threshold": "0.5",
            "metric_definition": "map@0.5"
          },
          "lifecycle": "unspecified",
          "source_authority": "summary",
          "evidence_ids": [
            "evidence-4bf122ba902a8712"
          ]
        }
      ],
      "decision": {
        "state": "pending",
        "human_confirmed": false,
        "selected_variant_id": null,
        "decided_by": null,
        "decided_at": null,
        "rationale": null,
        "history": []
      },
      "notes": [